{
  "sha256": "4b6714e4871048aed2f7c3a40b0898bcc533312ca652c2cc1dc1ed84d09cd9cd",
  "route": "pages/availability/index",
  "scenario": "slots-empty",
  "logical_width": 390,
  "device_pixel_ratio": 3,
  "operating_system": "iOS 10.0.1 / iPhone 12/13 (Pro) (WeChat Developer Tools profile)",
  "wechat_version": "8.0.5",
  "base_library_version": "3.15.2",
  "developer_tools_version": "2.01.2510290",
  "commit": "cca405f06b2f6542073b36ba8ceb78027dff59ea"
}
