{
  "sha256": "8e73d669e6492dcf6cc7e03bdb4d4c15f67663ce8ab7cd84cba1e61da5c828f0",
  "route": "pages/venue/index",
  "scenario": "venue-ready",
  "logical_width": 375,
  "device_pixel_ratio": 3,
  "operating_system": "iOS 10.0.1 / iPhone 12/13 mini (WeChat Developer Tools profile)",
  "wechat_version": "8.0.5",
  "base_library_version": "3.15.2",
  "developer_tools_version": "2.01.2510290",
  "commit": "cca405f06b2f6542073b36ba8ceb78027dff59ea"
}
